"page_id";"element_id";"text";"line_id";"section_title";"morelines";"section_no";"several_lines";"several_line_title";"section_title_text";"page_of_section";"text_line_id";"text_line_id_start";"text_line_id_end";"section_text";"chapter_no"
4;3;"a.3.4      prototyping ...................................................................................................................................................... 25";86;"a.3.4      prototyping";FALSE;"a.3.4";FALSE;FALSE;"prototyping";25;"577";577;587;"a.3.4             prototyping this requires that a prototype(s) of the system be built to simulate system operation. at this stage, it is important that the prototype has an easily modifiable user interface. for example, an interface could be constructed using a throwaway software interface prototyping tool to provide a gui 'facade' that has no real network functionality, however to the user, it will appear real. the use of such a tool is particularly useful early on in the development cycle, where often issues are not clearly defined and changes can be expected. the prototype should simulate any known factors that affect human performance (e.g. ability to recognize major fault conditions without ambiguity, particularly when more than one occurs at a given time from different parts of the network, long response times, communication link failures, etc.). the prototype should be appropriate to the current stage of design process and may vary from a paper prototype to a full system user interface simulation. 26                               eg 201 024 v1.1.1 (1997-05)";"a"
4;4;"a.3.5      usability testing ............................................................................................................................................... 26";87;"a.3.5      usability testing";FALSE;"a.3.5";FALSE;FALSE;"usability testing";26;"588";588;597;"a.3.5           usability testing ideally using a prototype(s) iterative user testing can be undertaken. prospective users who have not been involved in the design process, (or user surrogates matched in knowledge and experience) are allowed to use the prototypes to perform simulated tasks. during usage, these users are discreetly observed, but are allowed to commit errors. from an analysis of the error patterns among several users, inferences can be drawn about aspects of the user interface design that are likely to generate errors or inefficiencies in the final version of the interface. the testing process may be done only once if user performance matches the desired usability criteria on the first version, but it is far more likely that there will be several aspects of the interface that require redesign, and an iterative design approach will be necessary. user-centred design, consisting of task definition, task analysis, task allocation and prototyping/testing, is the most effective procedure for user interface quality assurance.";"a"
4;5;"a.4   tmn g interface design ........................................................................................................................26";88;"a.4   tmn g interface design";FALSE;"a.4";FALSE;FALSE;"tmn g interface design";26;"598";598;608;"a.4             tmn g interface design designing a specific g interface has two distinct aspects: -   the application domain.  and -   the interaction elements. the application domain is that aspect of the g interface that is specific to the network management application. the interaction elements constitute that aspect of the g interface that specifies the workstation terminal features that help a user orchestrate the application functions. together, these aspects define the method of communication between the user and the system that supports user performance of oam&p tasks. the interaction-elements aspect and application domain aspect are interdependent, and should be combined within a user-centred design approach.";"a"
4;6;"a.5   application domain................................................................................................................................26";89;"a.5   application domain";FALSE;"a.5";FALSE;FALSE;"application domain";26;"609";609;657;"a.5             application domain the application domain aspect of the g interface involves the expansion of the tmn information model to support the user interface. this complex process includes the following steps: a) evaluating the tmn information model and its object classes from the users perspective.  b) identifying the users mental model of the network and network functions.  c) determining the new object classes needed to bring congruence between the users mental model and the tmn information model. the tmn information model and its object classes are defined in existing operations system/network element (os/ne) interface standards (such as the oam&p messages in ansi t1.215 [2]). these standards also specify the protocols required to communicate between an ne and its os to support network operations. in order for a specific g interface to achieve the goals stated in this standard, the protocols for communicating between a user and the tmn will necessarily be different from those protocols specified in machine-to-machine standards. additionally, while the tmn information model and the users view of the network may address similar information content, the information model shall be defined from a user perspective. the second step requires a good understanding of the users expectations as well as knowledge of how the user views the network and the tasks defined in the osi management categories (i.e. the users mental model of the network). this will indicate areas where the tmn information model shall be expanded to support the user interface in a manner consistent with the objectives of the present document. 27                             eg 201 024 v1.1.1 (1997-05) the third step involves the use of object-oriented design methodologies to identify new object classes that will enable the smooth flow of information from within the users mental model to the tmn and back. this process is by nature iterative, and requires a thorough understanding of the issues addressed in steps a) and b) above. it is essential that this step be performed while keeping the user perspective in mind. for example, the object classes shall be categorized in ways that reflect the users mental model. this includes understanding the user perception of the tmn oam&p object domain and of the tasks that the user will have to perform on the objects. important factors to recognize here include the frequency with which each task is performed, the phasing of performance of tasks, the types of users who perform the tasks, and other sequential and situation dependencies among the tasks. in general, the object classes will include the following five elements: -   a description of the object class.  -   its relationship to other classes.  -   restrictions on its usage.  -   the specification of its attributes.  and -   the specification of the actions that can be applied to its instances. a process similar to that used to analyse object classes should be used to package the required functionality into appropriate tools and sets of tools. it is essential that: a) the right set of tools be defined to allow users to efficiently manage telecommunications networks.  b) functionality is partitioned correctly among the tools.  c) the functionality to perform specific steps is available to users without unnecessary steps. it is also important that specific tools may be flexibly assigned to applications as required by specific customer environments. the final result of defining the application domain is that a new information model will be created that includes object classes from three areas: -   those already defined in the tmn.  -   those defined specifically to support the user interface.  and -   those which may be needed to represent new or unique elements not already included in the tmn. the functional partitioning will also need to be optimized, within the task allocation phase. this process requires knowledge of the technical aspects of the object classes defined for the tmn as well as an understanding of the user task characteristics. 28                               eg 201 024 v1.1.1 (1997-05)";"a"
4;7;"a.6   interaction elements ...............................................................................................................................28";90;"a.6   interaction elements";FALSE;"a.6";FALSE;FALSE;"interaction elements";28;"658";658;672;"a.6            interaction elements the interaction-elements aspect of the g interface encompasses those elements which are not specific to the network management application, but which help a user manage the application and its functions. this aspect consists of the specification of three basic components: the presentation elements, the dialogue methods, and the administrative facilities. the presentation elements are visual components of the user interface. clause 6 in ansi t1.210 [3] describes presentation elements that are specific to or especially important to the g interface.  it also presents criteria for using these elements. annex b of the present document describes a set of generic network element symbols recommended by ansi t1.232 [1]. dialogue methods constrain the manner by which a user communicates with the system. presentation elements are used within the framework provided, by dialogue methods. ansi t1.210 [3] clause 7 presents criteria for dialogue methods as used for network management applications. administrative facilities either administer the user interface or provide assistance in using the user interface. ansi t1.210 [3] clause 8 defines a set of such administrative facilities. 29                              eg 201 024 v1.1.1 (1997-05)";"a"
4;8;"annex b:             network element symbols ....................................................................................................29";91;"annex b:             network element symbols";FALSE;"b";FALSE;FALSE;":             network element symbols";29;"673";673;674;"annex b: network element symbols";"b"
4;9;"b.1   type and class of network element symbols..........................................................................................29";92;"b.1   type and class of network element symbols";FALSE;"b.1";FALSE;FALSE;"type and class of network element symbols";29;"675";675;683;"b.1           type and class of network element symbols figure b.1 shows examples of the symbols proposed to identify different network element classes, extrapolated from ansi t1.232 [1]. figure b.1: examples of the ansi recommended network element symbols 30                             eg 201 024 v1.1.1 (1997-05) figure b.2 shows examples of how the proposed symbols may be enhanced to identify different equipment functionality, extrapolated from ansi t1.232 [1]. figure b.2: examples of the ansi recommended symbols enhanced to show different functionalities 31                   eg 201 024 v1.1.1 (1997-05)";"b"
4;10;"history ..............................................................................................................................................................31";93;"history";FALSE;NA;FALSE;FALSE;NA;31;"684";684;689;"history document history v1.1.1         march 1997 membership approval procedure map 9719: 1997-03-11 to 1997-05-09 v1.1.1         may 1997   publication isbn 2-7437-1555-3 dpt lgal : mai 1997";NA
